{
  "definitions": {},
  "$schema": "http://json-schema.org/draft-07/schema#",
  "$id": "#/get-checked-in-gmrs-departure",
  "type": "array",
  "items": {
    "$id": "#/get-checked-in-gmrs-departure/items",
    "type": "object",
    "additionalItems": true,
    "required": [
      "gmrId",
      "updatedDateTime",
      "isUnaccompanied",
      "checkedInCrossing"
    ],
    "anyOf": [
      { "required": [ "vehicleRegNum" ] },
      { "required": [ "trailerRegistrationNums" ] },
      { "required": [ "containerReferenceNums" ] }
    ],
    "properties": {
      "gmrId": { "$ref": "gmr-types-schema.json#/definitions/gmrId" },
      "updatedDateTime": { "$ref": "gmr-types-schema.json#/definitions/updatedDateTime" },
      "isUnaccompanied": { "$ref": "gmr-types-schema.json#/definitions/isUnaccompanied" },
      "reportToLocations": { "$ref": "gmr-types-schema.json#/definitions/reportToLocations" },
      "vehicleRegNum": { "$ref": "gmr-types-schema.json#/definitions/vehicleRegNum" },
      "trailerRegistrationNums": { "$ref": "gmr-types-schema.json#/definitions/trailerRegistrationNums" },
      "containerReferenceNums": { "$ref": "gmr-types-schema.json#/definitions/containerReferenceNums" },
      "checkedInCrossing": { "$ref": "gmr-types-schema.json#/definitions/checkedInCrossing" },
      "inspectionRequired": { "$ref": "gmr-types-schema.json#/definitions/inspectionRequired" },
      "readyToEmbark": { "$ref": "gmr-types-schema.json#/definitions/readyToEmbark" }
    }
  }
}